{
  "allocation": {
    "python_tracemalloc_peak_bytes": 5040,
    "scope": "Python frontend heap; Rust allocator excluded"
  },
  "binding": {
    "overhead_percent": 2.84756383750433,
    "target_percent": 10.0,
    "within_target": true
  },
  "commit": "e83013ee65de2c2b25508c36f97ddcca3949ee32",
  "concurrency": {
    "entries_before_release": 2,
    "independent_runs_completed": 2,
    "overlapped": true
  },
  "event_delivery": {
    "batch_conversion_ns": 259125,
    "ffi_batches": 21,
    "logical_events": 517,
    "model_deltas": 512,
    "python_callbacks": 0,
    "rust_model_requests": 1,
    "serialized_bytes": 296590
  },
  "external_io": {
    "included_in_binding_comparison": false,
    "measured_ns": 0,
    "scope": "No network, provider, filesystem, or external store I/O"
  },
  "format_version": 1,
  "idle_memory": {
    "native_session_reference": {
      "baseline_kib": 1792,
      "bytes_per_session": 61824,
      "incremental_kib": 7728,
      "resident_kib": 9520,
      "sessions": 128
    },
    "native_within_target": false,
    "python_heap_bytes_per_idle_handle_pair": 148,
    "target_bytes_per_session": 32768
  },
  "parameters": {
    "deltas_per_run": 512,
    "runs_per_sample": 64,
    "samples": 9
  },
  "platform": {
    "machine": "arm64",
    "release": "25.5.0",
    "system": "Darwin"
  },
  "python": "3.14.3",
  "throughput": {
    "native_model_deltas_per_second": 265790.1992589411,
    "native_within_target": true,
    "python_model_deltas_per_second": 258431.2057005848,
    "target_model_deltas_per_second": 100000.0
  },
  "timing_ns": {
    "construction_median": 79458,
    "external_io": 0,
    "ffi_batch_conversion": 259125,
    "import_median": 3756334,
    "native_runs_median": 123285208,
    "python_runs_median": 126795833
  },
  "workload": "rust-backed-python-fast-path-v1"
}
